,title,selftext,subreddit,created_utc,author,num_comments,score,is_self,timestamp
312,A Seinfeld podcast by someone watching the episodes for the first time,"My friend and co-host posted about the podcast we started a few months ago called [No Hugging, No Learning](http://nohuggingnolearning.libsyn.com/) and  I just wanted to update everyone that we just finished season 2 this past Sunday! 

I've never seen any episodes of the show and, before recording, I'm watching them for the first time so it's really cool to finally **get** what everyone's been talking about all these years.

If you're looking for something to listen to in this post-Seincast world, consider checking us out!  
We're available on Apple Podcasts, Stitcher, Spotify, and everywhere else.

https://i.redd.it/fodvw937xyt11.png",seinfeld,1540314856,TheTedHallowell,5,1,True,2018-10-23
316,"Kramer querks, behaviors tips for Halloween costume?","I’ve watched a little Seinfeld in my day. Not a lot. I’ve been compared to Kramer in some ways and I’m convinced to dress as such this weekend for a costume Brewhaha. 

The attire is pretty well settled minus the shoes. I’m curious what kinds of Kramer things I can say and do to sell the costume?  I plan on practicing the chug with a cigarette any other antics I could use please let me know!",seinfeld,1540343743,Dalbike,24,1,True,2018-10-23
335,"Please help me find this episode. It’s on the tip of my tonue, but cannot find it online. Thank you in advance.","All I remember from the episode is that Kramer and another of the main cast is in an apartment where Kramer’s mother had previously lived. The current tenant of the apartment talks about how crass and foul Kramer’s mother was, saying she walked around with curlers in her hair, sucking down beer by the can. Kramer gets really upset, and I think he almost punched the guy. 

I’m sorry if that isn’t enough info to go off of. I appreciate your help. Thank you. ",seinfeld,1540426225,glennettbennett,5,1,True,2018-10-24
337,Wholesome moments in the series?,"We all know about ""no hugging, no learning"" but what are the (brief) wholesome moments in Seinfeld? Perhaps Elaine's acceptance that her mimbo Tony is now a hideous freak. Also, Kramer and the car salesman Stan had some nice moments.",seinfeld,1540435213,kramerica_intern,18,1,True,2018-10-24
349,TIL Jack Klompus was only 55 when he gave Jerry the pen,,seinfeld,1540523485,RUAutisticWellUR,19,1,True,2018-10-25
350,Has anyone else heard of the fan theory that Kramer is a pot dealer?,"I forgot where I heard this from, but ...
The show makes a lot more sense if you watch it assuming Kramer is pushing the green good good off screen.
- That’s why he has such a wide, eccentric social network around nyc
- That’s why he’s always busting into Jerry’s place to get a snack 
- That’s why he gets jittery and easily startled at times
- How do we know for sure those cigars are always straight tobacco?
- This also explains why he never has real, steady employment yet doesn’t seem to struggle with having money too much
I think there’s a few more “clues” like that, but I can’t remember them all right now. Like I said, not sure where I got this from, maybe it was posted here before?
Idk how explicit that’s supposed to be in the show or how much the writers might have had this in mind but yeah, would love to hear from y’all about this !",seinfeld,1540526087,flexbrojas,19,1,True,2018-10-25
353,You’re a rabid anti-dentite!,,seinfeld,1540538215,speedracer73,20,1,True,2018-10-26
365,Does anyone know if there are any houses to rent in Tuscany?,Asking for a friend who is interested in taking a trip.,seinfeld,1540584808,EchoInTheRoom,11,1,True,2018-10-26
367,You gotta pull on the knob as you turn it.,Get the hell outta here with your knob!,seinfeld,1540586992,CrestedBlazer,1,1,True,2018-10-26
368,"Well, why can't he play for us?",They're only comfortable with their equipment.,seinfeld,1540591759,CrestedBlazer,4,1,True,2018-10-26
388,The Bris - interpretation.,"In The Bris, are they making fun of people who have been circumcised? Or who haven’t.

When Elaine says it has no face, no personality.

Wen George says he has only met 1 before.

Etc..

It’s unclear to me if they’re all circumcised, or no-one is.",seinfeld,1540678328,Juxta1984,8,1,True,2018-10-27
404,"In ""The Airport"", Elaine gets angry with a skycap for saying that he usually got 5 dollars per bag as a tip, would that have been highly unusual at the time?","In my country (Argentina), that would be absurdly high, but our currency is going to shit, so I don't know how to view the situation from an American perspective.",seinfeld,1540760076,cloudor,1,1,True,2018-10-28
408,Good Seinfeld quotes for a senior quote?,"I’ve been watching Seinfeld my whole life, literally. I’ve probably seen the show at least three times over in the course of my years on earth. 

I’m graduating this year and am wanting to use a quote from Seinfeld for the yearbook. Full circle moment. 

Does anyone have any ideas? It has to be “appropriate”, really meaning no cuss words/slurs. 

I have a few in mind, but I would love to see some suggestions! ",seinfeld,1540786213,sum1inphx,12,1,True,2018-10-29
419,How did Jerry give a lane ulcers ?,"There's an episode where Elaine is getting tested for ulcers and wonders out louad, "" Who could've given me ulcers?"" then she looks at Jerry and he changes the subject-  the implication being that he did give her the ulcers..

 i've never understood this joke..  is the joke that Jerry just stressed Elaine out enough to give her ulcers?",seinfeld,1540828280,CheeeseBurglar,3,1,True,2018-10-29
427,Season 2 not amazon prime?,Anybody else have this problem?,seinfeld,1540855847,PMme_alwaysSunny,4,1,True,2018-10-29
429,Anyone have that video someone made to This Is America with Seinfeld clips?,"Title says it all. Look to the title, Elaine. Look to the title.",seinfeld,1540860228,PowerGoodPartners,0,1,True,2018-10-29
431,"One of the legendary lines that would never show up in any other show: ""I hate the big brokerage houses. Hate 'em with a passion. Big brokerage houses killed my father...""","""...Well, they hurt him badly. Really hurt his feelings. It's a long story, I don't like to talk about it.""",seinfeld,1540867845,signs_unbreakable,7,1,True,2018-10-29
432,Someone needs to make Seinfeld as Sims and post for us to enjoy!,,seinfeld,1540873610,missthedismisser,0,1,True,2018-10-30
442,Finished watching seinfeld. Now I feel empty inside,"Every time I felt a little down I would just watch some Seinfeld and it would always cheer up. I felt like those four friends were my friends, that I would hang out with, and they'd always do funny retarded shit that would make me laugh. But now that I've finished it I just dont know what to do anymore. Life is meaningless",seinfeld,1540926400,BreaDKatka,5,1,True,2018-10-30
447,The English Patient comes to Netflix on 11/1,,seinfeld,1540956728,TalkingChairs,6,1,True,2018-10-30
448,"What did Kramer mumble in Italian in ""The Couch""? (Season 6 Episode 5)","Does anyone know what was the unintelligible Italian Kramer mumbled? He was making pizza with Papi and as he spread the tomato sauce over the pizza, he pretended to be like a chef and mumbled some random Italian words.


Anybody know exactly what he said?",seinfeld,1540958700,raydougas,1,1,True,2018-10-31
454,Who’s the smartest character in the show?,"Out of the gang, surely it’s Jerry? I mean Elaine absolutely bombed her IQ test and Kramer was always supposed to be behind the others. Thoughts?",seinfeld,1540989389,_hornbag_,7,1,True,2018-10-31
478,"I hate Seinfeld. Its the most negative show, Jerry’s voice is beyond annoying, Kramer is the only minutely funny person on the show although he’s super cringeworthy. George is a pathetic human being, and Elaine should raise her standards and get better friends.",,seinfeld,1541045754,NingoBingaloo,21,1,True,2018-11-01
486,Today I learned...,The original title for “War and Peace” was “War— What Is It Good For?” Tolstoy mistress didn’t like the title and insisted him change it to “War and Peace”. ,seinfeld,1541091769,pinkfloyd_the_barber,1,1,True,2018-11-01
494,"""You don't understand. A garage... I can't even pull in there. It's like going to a prostitute. Why should I pay, when if I apply myself, maybe I could get it for free?""","&amp;#x200B;

![img](smy5ecaw4tv11)",seinfeld,1541118949,rgundlach1,1,1,True,2018-11-01
497,I love Seinfeld because every time I watch it I never realize two story lines are in the same episode,For example. The Duncan Meyer head start and dating the communist. There are so many storylines I don’t realize are the same episode until I’m watching it. Only show I know of that does this that well.,seinfeld,1541128216,neverbeen1,13,1,True,2018-11-01
1,You match with someone on tinder. What quote do you use to ensure a date?,,seinfeld,1536435786,cycl0p58008,12,4,True,2018-09-08
6,Elaine twice complained about oral sex. I think oral is her thing more than the D.,"1. The saxophone guy won't go down on her, then he does are ruins his show.

2. Puddy uses Jerry's 'move' with the counter clockwise swirl. ",seinfeld,1536454922,Digitalabia,3,0,True,2018-09-08
10,"Top 3 ,Bottom 3 episodes","I’m new to this thread but have watched Seinfeld for years and I’m addicted to these posts. 
Haven’t seen it yet but was curious of the groups top 3 and Bottom 3 episodes . For me

Bottom 3
1.. The Betrayal
2. The Dog
3. The Finale 

Top 3
1. The Merv Griffin Show
2. Summer of George
3. The Pen 

What about everyone else?
",seinfeld,1536474416,unofficialuser112,4,2,True,2018-09-09
12,"I designed some Seinfeld inspired enamel pins out of some ideas I had on my mind: posh snicker eating, can't spare a square and more",[removed],seinfeld,1536478377,VegansoftheWorld,0,1,True,2018-09-09
19,Kramer Sunglasses,"Does anybody know what brand of sunglasses Kramer is wearing here?

http://2.bp.blogspot.com/-s5RsmAXVx-A/VbLAL0TchII/AAAAAAAAgbU/ewIkXnBVb1A/s1600/michael%2Brichards%2Bcosmo%2Bkramer%2Bseinfeld%2B1990s%2Bsunglasses.jpg",seinfeld,1536521082,DasRonkas,3,4,True,2018-09-09
20,I really think that Poppie did in fact wash his hands.,When I worked in a restaurant the bathroom sink was horrible and the sink in the kitchen was much better. I would never wash my hands in the bathroom unless there was a customer in there too. I guess that’s where Poppie went wrong. I just think if you’re making pizzas in a NY restaurant you *have* to know to wash your hands. ,seinfeld,1536521765,vulgarswamiyako,17,12,True,2018-09-09
30,Trivia,Is there a scene where Kramer opens the door and bangs it into someone while doing so?,seinfeld,1536569694,seeeba,2,2,True,2018-09-10
45,All right! But hear me and hear me well!,"The day will come — oh, yes, mark my words, Seinfeld — your day of reckoning is coming, when an evil wind will blow through your little play world and wipe that smug smile off your face. And I’ll be there in all my glory, watching, watching as it all comes crumbling down!",seinfeld,1536645525,Bigpants1001,1,1,True,2018-09-11
63,Am I the only one who thinks Bania would have been a great Joker? No?,,seinfeld,1536726402,AFriendlyChicken,7,7,True,2018-09-12
65,"What is the music that is playing at the end of episode "" The maestro "" when they are in Tuscany ?","  
",seinfeld,1536745487,GeorgeCostanzaTBone,2,4,True,2018-09-12
69,"I was wondering how many kids in our school district had Seinfeld fans for parents, so I ran a report. Lo and behold.",Kids named Seven https://imgur.com/a/7zLEYp0,seinfeld,1536764401,Waff11e_c0ne,10,13,True,2018-09-12
80,And Don't Forget Your Steamed Broccoli.,,seinfeld,1536797306,PeanutNutter49,6,8,True,2018-09-12
85,Most unlikeable characters?,"[Monk's manager](http://www.siyumhaseinfeld.com/images/chars/black.jpg) (very bad quality pic)

[Kramer's actor](https://vignette.wikia.nocookie.net/seinfeld/images/a/a1/Untitled.png/revision/latest?cb=20111226144031)

What are yours?",seinfeld,1536804563,mikKiske,14,5,True,2018-09-12
107,"Susan my annoy me, and all of us, but she I think she really had George’s best interest/best match at heart.","When I think about it, she never really disagreed with him in any of the big ways that would off-set George.  She may have moved into his apartment and ruffled his style, but she was never a bad girlfriend. 

George did lots of terrible things to Susan and her family. But when George went to the rebuilt cabin, Susan was completely in in his scheme.  She was even concerned about Yankee management discovering his car was in disarray.  

I know this isn’t the sort of thing we see on such a fun and silly subreddit, but Susan wasn’t that bad.  ",seinfeld,1536893191,dreamerkid001,0,4,True,2018-09-13
112,Who is Jerry's prettiest 'girlfriend'?,Just watching 'The Friar's Club' episode and I reckon Hallie (Susan's friend) is probably the best looking one,seinfeld,1536931583,OlympicDreaming,23,7,True,2018-09-14
113,TGIF! Who else is having Champagne Coolies this weekend?,"&amp;#x200B;

https://i.redd.it/jwbdru20z7m11.jpg",seinfeld,1536937601,JAlbert653,7,12,True,2018-09-14
114,Kramer’s coffee table book,"The original idea to put coasters on the cover was so much better than the little legs. 

",seinfeld,1536946942,lawnboy90,0,0,True,2018-09-14
122,I made a new coffee Table Book of Coffee Tables for sale,"Some of you messaged me to make a new table and sell it. I can't make dozens to sell invidually so it's up in auction on eBay!

http://rover.ebay.com/rover/1/711-53200-19255-0/1?icep_ff3=2&amp;pub=5575378759&amp;campid=5338273189&amp;customid=&amp;icep_item=223145895586&amp;ipn=psmain&amp;icep_vectorid=229466&amp;kwid=902099&amp;mtid=824&amp;kw=lg&amp;toolid=11111",seinfeld,1536974104,agr92,0,10,True,2018-09-14
123,Does anyone have footage of a certain clip from the Stock Tip?,I heard on Seincast that there's a behind the scenes clip from this episode where the girl from the bus stop comes upstairs and does a strip tease.  I've never heard of this scene before and was curious if anyone had it.,seinfeld,1536985057,nythrowawayr,2,4,True,2018-09-15
131,"“The Pitch”, Kramer speaks Italian.",Does anyone know what Kramer says in Italian when he answers the phone in “the pitch” after he gets kicked in the head? ,seinfeld,1537037927,Mr_ChandlerBing,3,3,True,2018-09-15
135,Does anyone like the Harold and Manny characters?,"Not to dwell on the negative, but I sure don’t. They are painfully unfunny and I’m glad they were written out. 

In fact, I hate ANYONE who likes Harold and Manny. ",seinfeld,1537049325,tuskvarner,4,0,True,2018-09-15
136,Any wallpaper of Jerry Seinfeld in his pyjamas?,"Nothing weird.

I want a poster (of Jerry Seinfeld in his pyjamas) to motivate me to go to sleep on time like a normal human being, just like Jerry Seinfeld does.",seinfeld,1537052027,isthiscompulsory,1,6,True,2018-09-15
141,How accurate is George's reaction to smoking?,Here is the scene https://www.youtube.com/watch?v=C02lvgmm4DQ Is this what everyone's reaction is like to their first cigarette? Never smoked tobacco but I have smoked weed and I think I did cough a lot my first time and burned my throat,seinfeld,1537064487,Purple_Tortilla_Chip,1,1,True,2018-09-15
142,Help Identifying an episode,"Hi, I'm looking for an episode where Jerry is talking with Kramer about something private while either George or Elaine is in the bathroom. Jerry says something very quietly, so George(?) doesn't hear, and Kramer practically yells it out. Its from either season 2 or 3 I believe.

Thanks for your help :)",seinfeld,1537072105,FakeRayBanz,1,1,True,2018-09-16
145,Say what you want about the bubbleboy but he had good tastete in music,Just watching the 'Bubble Boy' episode and noticed a 'Temple of the Dog' poster on his bedroom wall. He also has an Ugly Kid Joe poster but I'll forgive him for that,seinfeld,1537090842,NovaKay,0,1,True,2018-09-16
153,RANT - I hate watching Seinfeld on TBS.,"I know they've been doing this for a while, but the compression of the episodes to get more commercial time has gotten worse and worse.  I'd understand more if they didn't **also** cut scenes, but they're shortening the episodes and speeding them up to the point that they're just not watchable for me any longer.  I have them on DVD, but watching them on the DVR from TBS was always convenient.  But I hate them now.  The edits are sloppy, hilarious scenes are cut, and the dialogue and interstitial riffs are so fast as to be distracting.  End rant.",seinfeld,1537115759,johndoenumber2,7,9,True,2018-09-16
159,https://www.youtube.com/watch?v=wXbErKSwsQw,"If Newman drove a jeep in the jungle, then how would he deliver mail to New Yorkers? ",seinfeld,1537134969,Lance_Nuttercup,0,1,True,2018-09-16
163,Seinfeld Quote-A-Thon,The rules are simple: post a Seinfeld quote or part of a quote and see how popular it gets!,seinfeld,1537150135,spider-borg,66,20,True,2018-09-16
182,Looking for Seinfeld related reading,"Hi all, I was asked by one of my good friends to read at his wedding next month. We're both big Seinfeld fans and I was hoping to incorporate a quote or excerpt from the show or a cast member into the reading somehow. I figured this would be the best place to look. Any help is appreciated! ",seinfeld,1537232433,skoogdoo,5,3,True,2018-09-17
193,George making a Superman reference.,"I know they talk about Superman a good bit throughout the show. I need your help figuring out if this one reference was in the show or a figment of my imagination. 

There is a scene where Kramer is talking to Elaine and she get mad when she finds out the advice he has been giving her is from Star Trek.

I have a vague memory of George doing the same type thing, saying an inspirational quote and then saying, Superman IV.

Does this ring a bell to anyone? ",seinfeld,1537280497,Aberdolf-Linkler,1,1,True,2018-09-18
196,Trivia against a die hard fan in a week,"Me and a friend are going one vs one in a week on seinfeld trivia, I’m wondering what the best way to prepare would be. I could only get so far through the series by the time it comes, how would you prepare? Thanks",seinfeld,1537297881,Sordiax,1,1,True,2018-09-18
205,I just had a great idea for a TV show,I coach a gymnastics team in high school. And I'm married. And my son's not interested in gymnastics and I'm pushing him into gymnastics.,seinfeld,1537321847,BananaCult,6,6,True,2018-09-18
207,Murphy Brown is coming back to TV,Here's hoping for an appearance by Steven Snell!,seinfeld,1537323448,My-Work-Reddit,1,21,True,2018-09-18
220,A show that Seinfeld Community loves besides Seinfeld?,,seinfeld,1537374341,Urvya,28,9,True,2018-09-19
222,Thoughts on Jerry IRL,"Seinfeld is like my favorite show, that being said, after watching comedians in cars getting coffee, I realize that Jerry is giant asshole. I mean really, tell me if y'all agree, he just sucks his own dick and acts like a compete pompous cunt. maybe its because he's been such a rich bastard for so long that its turned him to shit, I don't know. Frankly, his standup has always vanilla as fuck. Seinfeld was a great show but Jerry never really did anything else. 

WE ALL KNOW LARRY DAVID IS THE TRUE GENIUS OF SEINFELD! SHOUTOUT TO MY BOY LARRY

",seinfeld,1537378008,New-Backwood,7,5,True,2018-09-19
225,"“I met this six-year-old child, with this blank, pale, emotionless face, and the blackest eyes... the devil's eyes.""","https://imgur.com/a/fXidttX

",seinfeld,1537395708,BerniceKing,0,0,True,2018-09-19
239,Which episode is it where Elaine grunts into Jerry's intercom?,"I've just started watching Seinfeld, I'm up to season 5 episode 6 the lip reader, I've been watching in order. If anyone can help me find a moment, where Elaine instead of saying its me or its Elaine, shes makes a grunt sound into Jerry's intercom it would really help me out. I've been looking for it for days now and i can't find it.

Any help would be appreciated!!",seinfeld,1537451845,poptarts16,12,3,True,2018-09-20
240,Uncle Leo!,"Jerry: uncle Leo was supposed to give you 50$
Morty: he was? Well, I’m going to charge him interest! I could have invested the 50$!",seinfeld,1537454169,schwartzasher,5,3,True,2018-09-20
241,"“What is this, a Woody Allen film?” I tried to figure out what it means with Google but it whooshes over my head. I was born in the early 90s so it probably was past my time. Help me out, please?",,seinfeld,1537455440,raspberryredcabbage,7,2,True,2018-09-20
245,"Which ""giddyup"" is your favorite?",,seinfeld,1537468988,Vikinggiraffe,1,5,True,2018-09-20
269,Interesting go fund me for seinfeld fans... https://www.gofundme.com/65mfy1c,,seinfeld,1537590179,miketgeman101,0,1,True,2018-09-22
285,What would be a good plot for the pilot ‘Jerry’?,"After rewatching, I keep choosing random plot lines that Jerry and George could have used for their pilot for NBC. In the meeting they mention the time they waited for a table at the Chinese restaurant, or George mentions the time Kramer vomited on Susan. What plot line do you guys thing would be better than “the judge decrees he’s my butler”? ",seinfeld,1537656866,jessisyes,6,3,True,2018-09-22
302,Did we ever find out how much that jacket cost?,"Always wondered,....",seinfeld,1537740003,damiho,4,7,True,2018-09-23
305,God damn it i dont want seinfeld to end,Im at season 7 and im getting anxiety that i will soon finish the show. I started watching it at the begining of the month and Im just addicted!,seinfeld,1537745381,BreaDKatka,1,0,True,2018-09-23
306,Does it bother anyone else that Jerry always has his shirts tucked into his jeans but he NEVER wears a belt?!,,seinfeld,1537747594,clileslhs,24,26,True,2018-09-23
309,Which version of Frank Costanza did you like best - John Randolph or Jerry Stiller?,"John was only in one episode, but I liked him better. ",seinfeld,1537749789,GeoffreyStephens,6,0,True,2018-09-23
318,What is the ending of The Race episode referencing/paying homage to?,Now I am not certain that it is a reference to a movie or a show or something but the music and Jerry's acting didn't really feel like Seinfeld so I thought it probably was like the ending of that episode where they make Kramer the godfather. Can anybody help me out here? ,seinfeld,1537795780,CelalT,5,3,True,2018-09-24
326,I was stripped to the waist eating a block of cheese the size of a car battery!,,seinfeld,1537829272,jacques95,0,1,True,2018-09-24
332,Help me find an episode?,"So theres an episode where Kramer keeps putting slips of paper in a jar and taking stuff from Jerry's kitchen, anyone remember what season and episode or did I dream this up?",seinfeld,1537836950,dontfeedtheseagull,9,2,True,2018-09-24
342,A great response when someone can't figure out a solution to a problem.,"&amp;#x200B;

https://i.redd.it/pn4se2agreo11.jpg",seinfeld,1537891489,TremendousUpside,0,2,True,2018-09-25
356,Did Dr. Reston intentionally destabilize Joe Davola?,"The last we hear of Dr Reston is when Joe Davola tells him he fell in love with Elaine outside the office.. We know Reston was worried about him while on vacation about the consequences of being off his meds..

Is it possible that Reston intentionally destabilized him to prevent him from being competition for Elaine -- which ultimately leads him to go fully crazy for the events later?  (Opera, Pilot, etc)",seinfeld,1537938369,chromenomad,2,8,True,2018-09-26
358,What's your favorite Seinfeld transition music?,"We all know Seinfeld's slap bass music is iconic, there's some transition music that really stick out. One of my favorites is the one at the very beginning of The Butter Shave, also heard in The Soup Nazi right after Elaine is kicked out of the soup stand the second time.",seinfeld,1537949327,ANALOGPHENOMENA,3,7,True,2018-09-26
368,What's the best Seinfeld trivia name?,"I was at Seinfeld trivia last week in NYC and the guy who won (Costanzagrams on Instagram) went with ""woof woof, not bang bang"" which I thought was hilarious",seinfeld,1537995209,bruceyj,19,10,True,2018-09-26
371,Who wore it best?,"&amp;#x200B;

https://i.redd.it/t0h9eqxk2po11.png",seinfeld,1538016315,in_black,0,1,True,2018-09-26
378,Do we have a Discord?,I think it would be nice to have a subreddit Discord.,seinfeld,1538025444,ANALOGPHENOMENA,1,1,True,2018-09-27
386,r/seinfeld only needs 3692 followers to join the 100k club. Go Death Blow!,,seinfeld,1538047593,Jose_b112,1,1,True,2018-09-27
390,sagman bennett oppenheim and taft,,seinfeld,1538054862,ons114,7,5,True,2018-09-27
391,"Although, one wonders if War and Peace would have been as highly acclaimed, had it been published under it's original title, War-What Is It Good For?",,seinfeld,1538059240,hempels_sofa,2,19,True,2018-09-27
399,Least plausible scheme,"There are more outrageous ludicrous schemes but I never found Elaine's investment in her sub sandwich punchcard  believable. The explanation seemed clunky and forced, maximum effort exerted for a payoff that doesn't involve screwing over a foe or sex... if it was Kramer maybe. The chain of phone numbers.... I'm like c'mon",seinfeld,1538082846,Asterope97,2,1,True,2018-09-27
410,S9E4 Kramer and Neuman make sausages in Jerry's apartment. what music are they hearing?,,seinfeld,1538155906,chandru89new,8,6,True,2018-09-28
411,I’m upset,we never got a Newmanium party episode ,seinfeld,1538158772,vclapper,3,5,True,2018-09-28
412,My favourite scene.,"https://m.youtube.com/watch?v=_YoliGLJT2Y
",seinfeld,1538163858,_0verd0se_,8,6,True,2018-09-28
