,title,selftext,subreddit,created_utc,author,num_comments,score,is_self,timestamp
368,Anyone notice Newman looks alot like a burned out Artie Lange in this episode.,&amp;#x200B;,seinfeld,1535501723,DeerMan420,0,5,True,2018-08-28
383,Trying to remember a quote.,"[This comment in another thread reminded me of it:](https://www.reddit.com/r/mildlyinteresting/comments/9b9xrd/this_upright_statue_on_a_slope/e51gsl1/)  ""This is Jonathan R. Italic, he invented italics.""

There was a little throwaway joke when one of Jerry's girlfriends says something like, ""You're lying.  There was no ____ ____.""  Where the blanks are someone's name, and the last name is the name of a thing he was supposed to have invented.  There was nothing leading up to it IIRC, she just said that at the beginning of a scene and that was it.  I've been googling around and can't find it, and it's killing me.",seinfeld,1535587610,sterling_mallory,3,3,True,2018-08-29
385,Anyway to watch Seinfeld dubbed in French or Spanish online?,,seinfeld,1535605453,kdizzledog,5,2,True,2018-08-30
388,You want a beautiful name?,Soda,seinfeld,1535617265,zandeandecamde,7,15,True,2018-08-30
397,[Request] A composite image of George wearing both the Gortex jacket and the Sable hat,,seinfeld,1535660817,16-bit,1,5,True,2018-08-30
398,Season 9 Episode 11 in a language other than English?,Need this for a school project. Looking for this episode in any language other than English.,seinfeld,1535670152,kdizzledog,1,0,True,2018-08-30
403,What should I do with my TV guides?,"My parents sold their house and made me get all my stuff out of their attic.  

I now have 6 big boxes of TV guides from the 90s that I collected when I was a preteen. I doubt they are worth any money, and it feels like a waste to throw them out.  
Anyone have some good idea of what I should do with them?",seinfeld,1535676030,augustprep,2,3,True,2018-08-30
404,Scene Suggestions?,Hey everyone. I'm looking for a scene for an acting class I'm in and I was hoping you all could help. I thought it would be fun to use a scene from Seinfeld but I'm having some trouble finding one. They have to be 5-10 minutes and can only have 2 people in them. Any ideas?,seinfeld,1535680239,XD5133,8,3,True,2018-08-30
405,Did mr. Peterman not later recognize Cramer as the drug addict that he threw out of Elaine's office?,"I was watching season 9 episode 21 the clip show part 1 and I saw a clip of Kramer getting thrown out of Elaine's office when he was talking to her about the water pressure, I think. I started to think that's probably Peterman and Kramer's only interaction in the series but then I remember obviously Kramer sells the stories to Peterman. I believe that he sells the stories beforehand to Peterman. Regardless, it doesn't seem that Peterman recognizes him. I guess this isn't a huge deal but it almost seems like an error in continuity.",seinfeld,1535681837,breticles,9,0,True,2018-08-30
407,Jerry Seinfeld is a bad actor. Disclaimer below,"l have nothing bad really to say about the show but isn’t interesting to notice how awful an actor Jerry is when compared to the rest of the cast?

If you compare his acting prowess to Richards or Julia its crazy! He is truly awful lol.

I know its his show and just a sitcom but I just think its interesting thats its one of the greatest TV shows of all time and the lead is really not all that",seinfeld,1535685664,justforpornsubs5,19,0,True,2018-08-30
420,Does anyone have a link to Comedians in Cars Getting Coffee episode with Dave Chappelle?,,seinfeld,1535760602,mathhelpguy,4,0,True,2018-08-31
421,"""So get this, Mr. Peterman is finally letting me do some real writing""","I was just going through season 8 and am on The Van Buren Boys. At about the 4-minute mark I came across this really weird voiceover that's supposed to be Elaine's voice. It's an opening shot on Jerry's apartment so there's no characters on screen. Check it out here: [https://getyarn.io/yarn-clip/edf3cf67-b013-4ac9-b210-e346c0308593](https://getyarn.io/yarn-clip/edf3cf67-b013-4ac9-b210-e346c0308593)

It's better to listen to without pause and together with the next line (""He's got this book deal.."") to really hear the difference. It's seems like a lower pitch, slowed down or distorted audio.. or someone trying to imitate Julia Louis-Dreyfus. 

&amp;#x200B;",seinfeld,1535762250,DrVanostrand,3,4,True,2018-08-31
422,"Just realized Vanessa Marquez was the receptionist in ""The Cheever Letters"" when Kramer went to the Cuban embassy to try to get more cigars. RIP.","[https://imgur.com/a/itvaEJt](https://imgur.com/a/itvaEJt)

[https://www.cnn.com/2018/08/31/entertainment/vanessa-marquez-er-dead/index.html](https://www.cnn.com/2018/08/31/entertainment/vanessa-marquez-er-dead/index.html)

&amp;#x200B;",seinfeld,1535767418,japanishinquisition,0,0,True,2018-08-31
424,What happens when Seinfeld lets one emotion in?,https://twitter.com/vorpal_duck/status/1033371285575925760?s=21,seinfeld,1535768465,Xeluc,2,4,True,2018-08-31
425,"""The Race"" [Season 6, Ep 10] is my favourite episode","It's such so funny and sarcastic, great history and politcal jokes-- what's your favourite episode?",seinfeld,1535769005,jtsports272,7,5,True,2018-08-31
426,Which episode had the outro where Jerry made fun of the way Runway Models walk?,"Basically the title. There was one episode I saw on TV recently that had an outro where Jerry made fun of the way models walk along the runway. Basically they walk as if they have somewhere to go, they get there, and they're like well now I have to go back.

If someone knows which episode this outro was from, that'd be great. I tried looking it up on YouTube but couldn't find anything.",seinfeld,1535775941,MarkMVP01,4,2,True,2018-09-01
429,There should be a Sublime tribute band called Kramer's Buttocks.,,seinfeld,1535803708,draxxxsklounst,4,4,True,2018-09-01
437,Season 3 is an underrated masterpiece.,"In no particular order, some of the great episodes:

The Red Dot
The Tape
The Cafe
The Boyfriend
The Library
The Alternate Side
The Pez Dispenser
The Limo",seinfeld,1535840353,dalegrapes,8,17,True,2018-09-01
439,How come they rarely show reruns in the order they aired??,"Seinfeld isn’t as bad as other shows, but it makes sense to me. Would anyone else like to see this done? ",seinfeld,1535842055,teenmomkilla,5,6,True,2018-09-01
443,CCGA,"Man watching Jerry try to squeeze some interest out of that commedians in cars getting coffee episode with Todd Berry was excruciating!  What a wet blanket.
",seinfeld,1535893177,johnfornow,2,3,True,2018-09-02
444,What's your most Costanzian moment?,,seinfeld,1535895313,lizard_king0000,2,2,True,2018-09-02
448,Coffee table pictures for my coffee table book!,"Heya everyone, my roommate and I are working on a coffee table book about coffee tables, to put on our coffee table. I figured it would be pretty neat to use pictures of other people’s coffee tables from r/Seinfeld. So if you can take a high quality picture of your coffee table, I’d appreciate it! PM me with a picture if you can!",seinfeld,1535907120,AM_34,0,7,True,2018-09-02
452,What's in your opinion the best written Seinfeld episode?,&amp;#x200B;,seinfeld,1535915361,imposter3c,11,3,True,2018-09-02
455,So i just finished the first season of Seinfeld,"Amazon Prime now has the show and i finally decided to watch it and wow, im really enjoying the humour and the setting. Its so different to your standard sitcom and i really like the segmented comedy bits. ",seinfeld,1535941542,TTOMZ123,2,14,True,2018-09-02
459,So did Jerry get raped by the dentist and his assistant?,,seinfeld,1535957487,MosfaceDilla,10,12,True,2018-09-03
462,There you go,"&amp;#x200B;

[ https:\/\/twitter.com\/might\_be\_a\_mark\/status\/1036429761516630023 ](https://i.redd.it/up3gr6rzv1k11.jpg)",seinfeld,1535992271,manoelspecort,0,6,True,2018-09-03
489,Kramer fans are not real fans...,"I've heard a lot of people say (not on this sub tho, I'm new to this sub) that Kramer fans are not relly fans because they just watched the show casually (or even just clips) and he was the character that stuck out the most because of his physical comedy and funny sounds.

**I strongly disagree with that**

I've seen all seasons (some of them multiple times) and I'm a HUGE Kramer fan...

Not because of his physical comedy or his hilariously dumb ideas but because of his character.

Kramer is open and unfiltered... he will always tell you what he's thinking, and eventhough it may suck it's still better than being lied to.

He's open minded and loves people... He even lets random asian tourists sleep in his apartment.

He is REALLY comfortable with his Friends, always overstepping boundaries and invading personal spaces without malicious intent or even noticing.


Kramer may be really weird and ""over the top"" (lets face it... Kramer would not ""work"" in real life) but that's just the part that's played for comedy... 

If you take away all the goofyness and strange behavior that makes him funny and just look at his character you'll realise that Kramer is actually the nicest person... And THAT'S why they are all friends with him and don't mind when he's raiding their fridges.

Kramer is kind hearted, well meaning and ready to help... He just doesn't realise that he's not relly helping all that much.

Those are my thoughts, what are yours?",seinfeld,1536096036,TEDHARDYLEEN,5,4,True,2018-09-04
491,"What do you think is the ""perfect example"" of a Seinfeld episode?","For me, it's ""The Old Man"". It involves Elaine superficially trying to be a good person, George trying to fill the void in his life (and pick up women), Kramer on a zany scheme at Jerry's expense, and Jerry doing something simply for his own entertainment, with everyone failing miserably at the end. To me, that's the perfect example of a Seinfeld episode.",seinfeld,1536097400,grandmadevourer,12,4,True,2018-09-04
3,"Can someone please explain Jerry’s comedy at the beginning and end of the episodes, not one time has it been funny to me",Is it supposed to be not funny?,seinfeld,1531246714,Colorways_US,8,0,True,2018-07-10
8,One-Off Characters That Should Have Been Brought Back for The Finale.,"Now that its been over twenty years since the finale aired I thought this would be an interesting topic as to which characters that only made one appearance on Seinfeld should have been brought back for the finale. Three instantly come to mind for me:

3. Jean-Paul from ""The Hot Tub"" this was my favorite character from that season and he would have been a terrfic character witness since he not only was screwed over by both Jerry and Elaine but also by Kramer.

2. Timmy from ""The Implant"" he is the guy who famously accused George of double-dipping a chip at a funeral home.

1. Jimmy from ""The Jimmy"" this goes without saying that Jimmy was perfectly used in the absolute perfect amount. One episode. Any more and his whole schtick would have been stale. This may be true in theory yet look at the massive success of The Rock who years later rode speaking in the first person to incredible fame.",seinfeld,1531267053,ZenChampion,2,13,True,2018-07-10
10,Completed the series today!,"I saw a few episodes here and there before but started from episode one a few months ago, and watched the finally today! My only problem is now I'm referencing a show that is 20 years old. ",seinfeld,1531274012,MisterBowTies,10,5,True,2018-07-10
14,Kramer’s Entrance,"One of my favourite things about Kramer is that he has so much momentum when he enters Jerry’s apartment even though he only lives one step away, says a lot about his character",seinfeld,1531278360,gwhee1s,2,15,True,2018-07-10
15,HelpMeFind the episode/scene where we see George taking a nap in Jerry’s cabinets,,seinfeld,1531293320,vetofthefield,4,2,True,2018-07-11
25,What was the state of Jerry's career during the show?,"I'm talking about Jerry Seinfeld the character. How was his in-universe career doing? They had the failed pilot and then you would hear characters make comments or jokes about his career sometimes. Like how George and Kramer wanted him to do the Bloomingdale executive training program, or the time that Jerry got bumped from career day and then Letterman cancelled on him.

So what can we surmise about his stand up career throughout the series?",seinfeld,1531336747,Eggs_is_eggs,9,5,True,2018-07-11
42,"A few of my friends and I have started writing ?s from the show. Just found this sub so I’m gonna start posting them! Q1: what is Kramer’s first name?? — just kidding, what a lame ?. What movie did Kramer (Cosmo) mistakenly get a Tony for?",,seinfeld,1531409877,bhs8566,8,1,True,2018-07-12
48,Seinfeld Movie Posters,"Moving into my new place this weekend and want to start decorating my room with all the movie posters from Seinfeld, anyone know where I can source them? ",seinfeld,1531440443,ShedZombie,3,10,True,2018-07-12
50,If I loved Seinfeld would I like curb your enthusiasm?,This might sound blasphemous but I’ve never seen a single episode.,seinfeld,1531449047,sku11_kn1ght,9,5,True,2018-07-12
54,"Which episodes best exemplify a ""show about nothing""?","Seinfeld was of course brilliant at sprinkling the dialogue with lots of remarks and asides that added great comedic depth to the character.  Lots of this dialogue was completely unnecessary for the plot but was absolutely brilliant in the way it brought the characters and comedy to life.  There are plenty of episodes with story arcs of course - such as Jerry unwittingly agreeing to wear a puffy shirt on television, etc.  Which particular episodes have the least plot points and are the best examples of a show about nothing?",seinfeld,1531466935,intheaterssoon,8,4,True,2018-07-13
61,Puerto Rican day parade ep. have you seen it?,,seinfeld,1531510568,deszy04,11,2,True,2018-07-13
63,I just pulled a George -- am I to feel shame?,"This morning I'm eating a breakfast burrito. It's delicious but too much, I toss the last 20% in the trash. 

Just now at lunch I'm still too full to eat, so naturally I just go and have three beers instead. 

Get back to work, a little tipsy, feel snacky, notice the burrito remains still fully wrapped up in foil and nothing else is in the trash (cleaning crew came this morning). Ate it.",seinfeld,1531514796,snoopwire,19,18,True,2018-07-13
79,Jerry gets instant coffee after meeting Mr. Bookman,"Mr. Bookman makes the comment about keeping instant coffee in season 3. During ""The Contest"" in season 4, while irate from the contest, George asks Jerry why he only has instant coffee. ",seinfeld,1531614834,boogaloobear,4,3,True,2018-07-14
80,Summer of George plot hole.,"If you recall, George slips on the invitations and has to learn to walk again. His doctor says that his injuries are due to a prolonged period of inactivity. So basically, he sat on his ass so long that his legs went to shit.

BUTTTTTT.....he had just come from playing frolf. And he bounded up the stairs when he got home as well. His legs couldn't have been that bad.

",seinfeld,1531615637,Digitalabia,4,4,True,2018-07-14
81,Kramer's slicer and the cat.,"Why did Kramer drag the slicer all the way over to Elaine's apartment, when he could have just sliced off a few pieces of meat for Elaine to give to the cat. ",seinfeld,1531616379,Digitalabia,5,4,True,2018-07-14
84,"George screaming ""I hate I haaate!""","Have I lost my mind? Does anyone remember a cutaway from Tom's where George had an interview or something, and during an anxiety attack started just shouting ""I hate! I hate! I haaate!""",seinfeld,1531624226,AboveJester,2,1,True,2018-07-14
87,What all do we know about Bob Sacamano?,,seinfeld,1531645804,Lin0ge,22,11,True,2018-07-15
95,Elaine's IQ score fluctuation has an explanation other than the distractions!,"In the episode where George asks Elaine to take the IQ test for him, Elaine claims to have an IQ of 145, however when she takes the test in Babu's restaurant, she gets an 85. The equation for calculating IQ score is (mental age/chronological age) x 100. Since it was George's test, his age was the on the test, and since he is 9 years older than Elaine, her score turned out to be very low. At the end of the episode she takes the test again using her own age and scores a 151. Her restaurant score is also affected by the distractions of course, but the major contributor is the age difference!",seinfeld,1531705080,TheFcknG,6,10,True,2018-07-15
99,Favorite Name,"I always get a kick out of the names of the side characters on this show. Sue Ellen Mishke, Todd Gak, Pinkus the drycleaner...I could go on but does anyone else have a favorite name?",seinfeld,1531731541,KidReeflay,31,5,True,2018-07-16
112,"I love when there are times in episodes where there's a main conversation, but then George will be having a separate conversation that's unrelated, then goes back to main conversation. But I can't think of any specific examples at the moment.","Does anyone know what I'm talking about and if so, specific episodes or how the conversation went. Like Jerry and Elaine will  e discussing one thing and when theres a lull in the conversation George says something, then Jerry and Elaine continue on, then George says something else about what he said earlier. I was telling my non Seinfeld-watching friend about it because it's what we were doing for awhile but I couldn't think of a specific to send him a video.",seinfeld,1531777969,notsure500,5,6,True,2018-07-16
114,"My boss use the ""no soup for you"" Seinfeld clip to explain to us that we're not getting our quarterly bonus","He called us into the conference room for a meeting, treated us to pizza and sodas. We had absolutely no idea what this meeting was about. Then he showed us the Seinfeld clip where Jerry tries to rent a car but they ran out of cars even though he had a reservation. Hey used this clip as any example of bad customer service, but we work I  a warehouse so that makes zero fucking sense. There's other people I  three company that deal with customers but not us warehouse folk. So whatever, I guess.

Then my boss told us all about how we aren't making our bonus this quarter, then finished off with another Seinfeld clip with the soup Nazi cause it's funny. But really, he basically said ""you're not going to make your bonus, no soup for you!""",seinfeld,1531779710,MrDeez444,3,1,True,2018-07-16
128,What is with the red headed women?,Is it just me or does there seem to be a lopsided amount of gingers in the series? Is there any reason behind it?,seinfeld,1531865114,v650,2,1,True,2018-07-17
132,Favorite Kramer moments?,"It's tough but I gotta say, when Jerry loses his $500 and thinks the laundromat owner took it, Kramer takes matters into his own hands and pours a laundry bag of concrete into one of the washers. I just can't stop laughing. ",seinfeld,1531875045,RollinsLiar,26,4,True,2018-07-17
147,"""The Strongbox"" cufflinks?","I'm getting married in November, and my brother/best man is a HUGE Seinfeld fan. 

I've tried googling, but not much has come up. 

Does anyone in here know what the Jerry Lewis cufflinks look like? Getting him these would be a 3rd level reference/joke that would make both of us happy. 

Any leads would be greatly appreciated. ",seinfeld,1531925573,mag0802,1,4,True,2018-07-18
161,"“Seinfeld, FOUR?!”",another Seinfeld Chinese restaurant appearance  on king of queens!,seinfeld,1531975109,Stevenbk,8,8,True,2018-07-19
162,Which opening monologue has the sickest bass lines?,I just watched The Gum (S7 E10) and some of those licks are so tasty. Any others that stand out?,seinfeld,1531978016,didid_you_see,1,1,True,2018-07-19
163,Why is Seinfeld hated in Kansas?,https://www.google.se/amp/s/m.huffpost.com/us/entry/us_596f9a4ae4b05453c5cd18ce/amp,seinfeld,1531980318,Xeluc,8,6,True,2018-07-19
168,Does anyone else dislike the fan made seinfeld scripts?,"I’ve been scrolling through all of r/redditwritesseinfeld and checking different online links, and every fan made script is riddled with cliches like Bob Sacamano, full of bad dialogue between the main characters, and have no relatable plot. Now I have nothing wrong with people making these fan creations, I just get annoyed when people praise them for being just like seinfeld, when really it’s quite the contrary— anyone else feel the same way? ",seinfeld,1532006619,Trepanian,6,6,True,2018-07-19
169,A bot wrote an episode of Seinfeld,[Check this out!](https://twitter.com/keatonpatti/status/1019276835186724868?s=21),seinfeld,1532009160,Imperial-Green,7,17,True,2018-07-19
185,Newmanium...,"Just caught the episode. Newman and Kramer have separate parties planned on NYE 1999  before agreeing to combine them. Towards the end of the episode, Jerry explains to Newman that the actual millennium start is 2001 making Newman’s gig one year LATE. 
Is this a major screw up never noticed by production or am I missing something here?",seinfeld,1532044867,MetraConductor,7,2,True,2018-07-19
186,Which character do you most identify with?,"No matter what you say/think let’s face it, we’re all a bunch of George’s.....maybe a Putty here and there",seinfeld,1532045925,toadallyfroggie,15,14,True,2018-07-19
188,Cartwright.. CARTWRIGHT?,My friends do not get this reference. Posting here because you guys will get it..,seinfeld,1532049077,torkona,18,43,True,2018-07-19
189,"One of the things I always liked about Seinfeld was that it rarely came off as being sitcom-y. Having said that, can you think of any examples where it was sitcom-y?",Remember when Kramer kissed Jerry in ‘the kiss hello’ at the moment George walked in.  He didn’t say a word and slowly backed out? Very sitcom-y! ,seinfeld,1532049658,mattscott41,5,3,True,2018-07-19
192,Seinfeld Music Video,[https://www.youtube.com/watch?v=Kz7GWsX\_Htw](https://www.youtube.com/watch?v=Kz7GWsX_Htw),seinfeld,1532056126,Story89,0,1,True,2018-07-19
193,A question about George....,"""Does any else here thinks that George killed Susan?""",seinfeld,1532057871,MicDrop2017,5,4,True,2018-07-19
194,So is it implied that George wanted to kill Susan?,"Or is it just a  joke, that has a few throwaway lines",seinfeld,1532058541,Yankeeknickfan,8,3,True,2018-07-19
196,Does a compilation of every one of Kramer’s freakouts/shakes/shudders exist?,"He has a lot in season 5 for sure, like the ugly baby, Poppi’s pee, etc. You know what I mean! 

",seinfeld,1532069118,vetofthefield,0,8,True,2018-07-20
197,Does anyone know how Kramer was able to afford an apartment in manhattan?,,seinfeld,1532073095,whatwherehowwhenWHY,26,18,True,2018-07-20
202,Wife advice from Jerry Seinfeld,"“Always give a wife whatever she wants. She will eventually see “Oh, I didn’t really want that”. You know she doesn’t want it. Let them find out on their own.”

[i]- From Comedians in Cars Getting Coffee (Ellen DeGeneres’ episode)[/i]

I’ve actually started to do that with my girlfriend and it works wonderful! ",seinfeld,1532103447,Kayters,3,6,True,2018-07-20
209,"Question for you guys, I hope you can help me.",Tan pants. Why do I buy tan pants?,seinfeld,1532124925,CrestedBlazer,1,6,True,2018-07-20
212,"Sometimes I say bad things to people, and when they give me the crook-eye, I says it's a Seinfeld quote, even though it isn't.",Should I be sent to jail?,seinfeld,1532132402,Cavemandrew,3,4,True,2018-07-20
215,I’m at a family reunion.,"I worked my ass off today, then got in the car and drove four hours where they put a drink in my hand when I walked in the door.

The evening went on, and a few more drinks go down, and my aunt starts telling this story about the time her Hreyhound bus broke down outside of El Paso when she was with her toddler son.

“El Paso?” I said, “I spent a week there one night!”

They all just looked at me. Not a single laugh. Not even a single “Ha!” 

I need a good “Ha!”",seinfeld,1532154798,PM_ME_STEAMED_HAMZ,14,34,True,2018-07-21
222,90’s Sitcom plot,Lots of the 90s sitcom plot and sketches would be ruined by the introduction of mobile phones. ,seinfeld,1532196557,RuboPosto,6,3,True,2018-07-21
223,Instagram Bio,Y’all I need help I need a seinfeld themed bio for my personal insta acct thanks guys,seinfeld,1532198217,justyoaveragefinfan,3,0,True,2018-07-21
225,Who is the redheaded chick in The Bizarro Jerry episode?,Her name is not listed in the end credits or imdb cast. ,seinfeld,1532202554,Fartwanker,3,2,True,2018-07-21
232,George moment,I’m at a wedding and just accidentally cut the bride off in line for the washroom. I could hear her saying how rude I was from inside.,seinfeld,1532226692,thirteenthsat,2,8,True,2018-07-21
234,Best episode for each character?,"For each of the 4 main characters, what were their best episodes?  For example, you might say that Kramer's best episode was the one with the Merv Griffith set.

Bonus:  Same question for side characters like Newman.",seinfeld,1532232418,punk999,10,8,True,2018-07-22
238,Is there a way I can legally stream the original aspect ratio of Seinfeld online?,"Or are the DVDs the only way I can watch it in that format? I planned to start it on Hulu but I was disappointed that they only have the widescreen version. Sure it's in hd but I'd rather get the full picture so if it maxes out in 480p then so be it. Was  the 4x3 version not part of the deal with Hulu or what? Considering they paid $180 million for the rights I kinda find that hard to believe, I wish they gave an option for both versions.

And correct me if I'm wrong, but considering Seinfeld was shot in film the 4x3 version can theoretically be remastered into 1080p or even higher, right? I'd be all over that if it was ever released on blu ray. 

Sorry if I'm coming off as a dweeb lol.",seinfeld,1532291514,Ordinary_Bee,0,2,True,2018-07-22
