,title,selftext,subreddit,created_utc,author,num_comments,score,is_self,timestamp
2,What's the deal with Jerry?,"So, Jerry wants nothing to do with the dirty-hands pizza from Poppy, but he doesn't think twice about Paco's rubber band in his soup... ",seinfeld,1554575217,SouthPawLilly,9,0,True,2019-04-06
8,This is an astronaut pen. It writes upside down. They use this in space.,,seinfeld,1554605030,iReddit5000,0,1,True,2019-04-06
9,Schnitzer's,"Every week I ask my girlfriend to buy me a marble rye when she goes shopping, and every week I’m afraid that she’s going to have to mug an old lady for it. ",seinfeld,1554605383,youweremyhero,0,0,True,2019-04-06
36,Watching happy Gilmore and I saw the old bag that Jerry stole the babka from as his grandma.,,seinfeld,1554678101,mr-mashed-bgravy,4,0,True,2019-04-07
37,Any Curb Your Enthusiasm fans?,"I’ve watched the series, most shows more than once, and think it’s up there with Seinfeld.
Larry David has three movies, he only acted in most recent one, but I liked Sour Grapes the best.

Also like Comedians in Cars Getting Coffee.",seinfeld,1554679303,Tim-Whatley-DDS,22,7,True,2019-04-07
38,Change to Hulu from Netflix,"How many of us switched to Hulu from Netflix solely because of Seinfeld? Or at the very least it was one of the biggest reasons? I know it seems dumb to switch because of one show, but come on... 

It’s been a year and I don’t regret it at all. ",seinfeld,1554680599,JonJonThiede,5,14,True,2019-04-07
43,"In your opinion, what is the most unrealistic moment in Seinfeld? For me I think it's George and Kramer going rock climbing with To-ny. I just don't see George on a cliff face.",,seinfeld,1554692506,LookBackInAnger1982,14,8,True,2019-04-07
51,"Can someone link me to a clip where george is singing somethings up, can you feel it",,seinfeld,1554726945,Trauf27,1,1,True,2019-04-08
57,"[Podcast] No Hugging, No Learning - The Keys (S3E23) + Season 3 Recap","This week, Tim and Ted finish up season three with The Keys by talking about giving your spare key to an inconvenient party, Elaine's Murphy Brown fan-fiction and what use of the F-word gets censored on TV! 

This is No Hugging, No Learning, the show about one thing...watching Seinfeld for the first time.

New episodes every Sunday!

[New Episode](http://nohuggingnolearning.libsyn.com/the-keys-s3e23-season-3-recap) // [iTunes](https://itunes.apple.com/us/podcast/no-hugging-no-learning/id1434886441) // [Spotify](https://open.spotify.com/show/5Q183GYUYXLPyj2RHw3NpX) // [Stitcher](https://www.stitcher.com/podcast/tim-murphy-and-ted-hallowell/no-hugging-no-learning) // [RSS Feed](http://nohuggingnolearning.libsyn.com/rss) // [Website](http://nohugging.com/) // [Twitter](http://twitter.com/@nohugging)

This is a show for people that have never seen Seinfeld, like me, or who are just looking for a fresh perspective on it. I'm watching Seinfeld for the first time and my co-host is watching back for the first time chronologically, after being a huge fan for years.

Have you been a lifelong fan of Seinfeld? We'd love to hear your take on these episodes too, because we don't go very heavy on research. Feel free to comment, [send us an email](mailto:nohuggingnolearningshow@gmail.com) or [DM us](https://twitter.com/nohugging)!

https://i.redd.it/5zxogv3au2r21.jpg",seinfeld,1554745256,TheTedHallowell,0,2,True,2019-04-08
61,One Shining Seinfeld Moment - Final Matchup,"Tonight the NCAA National Champion is crowned, and we are crowning our One Shining Seinfeld Moment too! Today is the last chance to vote in our bracket, see the links below

Original post: https://www.reddit.com/r/seinfeld/comments/b2hh74/one_shining_seinfeld_moment_bracket/?utm_medium=android_app&amp;utm_source=share

Bracket: https://www.bracketsninja.com/bracket/40982

Full episode: https://simplecast.com/s/3718d74e",seinfeld,1554750494,kalvinc2113,4,3,True,2019-04-08
62,Summer of George boat,Took this in Chicago years back.,seinfeld,1554750617,Bmangoz,0,1,True,2019-04-08
64,Seinfeld VHS set?,"Back many years ago before the DVDs of Seinfeld came out there was a set of VHS tapes floating around that had every episode with the “Castle Rock Entertainment” tittle screens before every episode. Does anyone by any chance still have a set of those? I would love to have one for my Seinfeld collection. I think there were two versions- one with 60 tapes and another with 20 tapes or so in slower speeds? Here is a picture of a “real” version, but the copy I had years ago was just ordinary VHS tapes and cases.https://i.imgur.com/m8NGgzy.jpg",seinfeld,1554751703,cp2k,1,1,True,2019-04-08
74,'DAVOLA' - coming October 2019,"A buddy of mine made a teaser trailer and I figured it needed a place on Reddit, and I don't think r/Joker would appreciate so I'll leave it with you guys to decide its sponge-worthiness.",seinfeld,1554764922,DoctorJoss,0,1,True,2019-04-08
87,Seinfeld quote finder,"There was a post yesterday about a Seinfeld quote finder where you put in the quote and it spits out gifs of that quote.

I thought I saved it, but it turns out I didn't.  Anyone keep that link?  These Reddit searches are making me thirsty.

Thanks.",seinfeld,1554824131,Elgato13,6,7,True,2019-04-09
90,Seinfeld would have been the perfect voice for the mouse in the new Dumbo film.,"Seinfeld https://www.youtube.com/watch?v=esPB4wCGdOM&amp;t=2m35s

Timothy Q. Mouse in Dumbo https://www.youtube.com/watch?v=y4B2Mw_yaW4",seinfeld,1554840320,Octagon_Time_Machine,0,0,True,2019-04-09
126,Pinky Toe? Is this a real scene or did I imagine it,"So I have a a memory of a scene where George and Jerry are up to something, and George is told to keep watch and to let Jerry know if someone is coming. George says, ""If someone is coming I'm going to yell ""pinky toe"" "" and Jerry is incredulous and says ""No, just make a bird noise or do something normal""... eventually someone is coming, and a flustered George stays yelling ""Pinkytoe! Pinkytoe!""  


Did I imagine this? I've tried googling it, but all I find are references to the season 5 episode ""The Fire"".

&amp;#x200B;

Is this a complete fabrication, from another show, or did this really happen?

&amp;#x200B;

Thanks.",seinfeld,1554934590,NeuroBill,11,0,True,2019-04-10
146,A Seinfeldian typo,"I couldn't get past this sentence in the news this morning...

&amp;#x200B;

[Source:  https:\/\/www.theguardian.com\/uk-news\/2019\/apr\/11\/julian-assange-arrested-at-ecuadorian-embassy-wikileaks ](https://i.redd.it/s9nocybhtnr21.png)",seinfeld,1554999251,jugdizh,1,11,True,2019-04-11
150,Soooo many inconsistencies!!,"I love the show, probably too much, but when you watch it all the way through there are so many contradictory stories. Just a few I can remember..

1) Jerry had a sister that he mentions once and never talks to?
2) Kramer not knowing you could wake up from a comma. He literally watched his neighbor do this. 
3) George says I love you to his gf then later says he never got to say it to anyone. But he is a liar so...",seinfeld,1555006169,Destinybender,26,0,True,2019-04-11
154,Need Suggestions for a Seinfeld-themed gamertag,"Hey, everyone! Since Playstation has now allowed users to change their online ID's, my friend and I decided we want to use a seinfeld joke, reference, or name to replace our old gamertags. I figured this place would have the best suggestions.

Thanks in advance for any/all suggestions!",seinfeld,1555015102,BilbosOlderBrother,10,2,True,2019-04-11
157,I'm watching Seinfeld for the first time in my life,"I'm currently in the middle of season 4. It's finally available for streaming in Canada on a service that I subscribe to. I grew up having it on in the household as my mom is a huge fan, but I never took the time to watch it myself. I must say, it's really great to see a contemporary world without cellphones. One theme I've caught on to in the series is the use of the telephone. It's often the punchline of the joke (Vandalay Industries; the Chinese deliveryman talking to the hair restoration place; Elaine's mystery message, etc), or central to the plot in some way. Kramer's use of Jerry's phone is hilarious, and that's something that's completely lost on society today.",seinfeld,1555019342,CoffeeAlwaysBlack,32,95,True,2019-04-11
176,"Golden Girls reboot, but it's Jerry, George, Elaine &amp; Kramer, all now retired, living in Del Boca Vista",,seinfeld,1555081483,Markkbrendanawicz,9,25,True,2019-04-12
179,What do you think Mr. Wilhelm’s ‘Big Project’ for George was about?,"All we know that payroll is involved and that it’s all ‘Downtown’. 

Later we find that Wilhelm did the project himself. 

What are your theories as to what the actual project entailed?",seinfeld,1555087197,rurlysrsbro,10,8,True,2019-04-12
183,775 votes away from LEGO making Jerry’s Apartment into a set! It’s go time!,https://ideas.lego.com/projects/d392b921-10a6-4f84-8229-dbc3951fd138,seinfeld,1555102515,tysenburg,0,2,True,2019-04-12
184,"If 10k people vote, LEGO will make Jerry’s Apartment into an official set. It’s go time Reddit!",https://ideas.lego.com/projects/d392b921-10a6-4f84-8229-dbc3951fd138,seinfeld,1555102655,tysenburg,6,19,True,2019-04-12
186,Michael Richards on Howard Stern,"One of the most cringe-inducing things I've ever watched.

[https://www.youtube.com/watch?v=Rl5ibpEEFW4](https://www.youtube.com/watch?v=Rl5ibpEEFW4)",seinfeld,1555106293,LovedYouCyanide,2,0,True,2019-04-12
193,Lets play a game. Someone will post a characters name and the next will post the first quote that pops into their head. I'll start with MILOS!,,seinfeld,1555117994,greenghost131,109,11,True,2019-04-12
194,George's new toilet.,"Thought I'd share something i wrote when i, myself, got a new toilet....

-----
George walks into Jerry's apartment.

George: Jerry, you're not going to believe what's happened! It's possibly the greatest moment in my life!

Jerry doesnt look up from his comic book.

Jerry: Hair plugs are covered under your new work's insurance?

George:  You can't crush my excitement.  I have been given the most glorious gift of a new toilet!

George throws his arms up in the air, smiling big and wide.

Jerry:  A new toilet?  

George: Can you imagine, Jerry!?  I've never had this experience before.  For once, no one has EVER used that toilet besides me.  

Jerry: Wow!  This is even better than your private toilet at the job where you pretended to be handicapped!

George chuckles.

George: I know!  I'm actually thinking of buying a lock for the door and keeping the key around my neck at all times.

Jerry: Isn't that a little excessive?

George snorts. 

George: Jerry, you don't understand, my friend.  You simpleton, who hast never been bestowed a virgin porcelain, will never understand.

 

-----

 

George's parents are stopping by to pick up George before a big dinner.  Frank claps.

Frank: All right George, you need to hurry up!  If we're ten seconds past the early bird special we have to pay full price!

Estel: Frank, quit being so cheap!  You know this is Georgie's special day.

Estel smiles real big.  

George, from the other room: Ma, it's not that special of a day.

Estel: Well, of course it is!  You've kept your job for three months.

Frank: We shouldn't be celebrating, we should be punishing him!  Why would we applaud such a meager accomplishment?  And can you HURRY UP THE CLOCK IS TICKING!

Estel: Well, actually, I need to use the restroom real quick.

Estel starts walking towards the bathroom.  George drops something and runs out to the living room

George: WHAT? Hahaaa, what?  Ma, you dont have to use the bathroom.

Estel frowns as George smiles and blocks the way.

Estel: Yes I do, Georgie. Now let me through to your bathroom.

George holds her back abruptly.

George:  But, but we REALLY need to GO!  We'll miss the early bird special!

Frank: He's right.  You can hold it.

Estel: George, let me go.  

George: Now, come on, we really have to get going and the bathroom at the rest--

Estel: George, i don't feel very well.  I need to use your bathroom.

George: Yeah, but we really –

Estel: GEORGE, LET ME USE YOUR BATHROOM!

Frank: Will you LET YOUR MOTHER USE THE BATHROOM ALREADY!? WE'RE GOING TO MISS THE SPECIALS!

George flusters and starts screaming.

George: ALL RIGHT! ALL RIGHT! SHE CAN USE THE BATHROOM! ...But only if you answer a simple question first.

Estel &amp; Frank: What?

George stiffens up and licks his lips.

George: Number one or number two?

Estel: George!

Estel tries to push by, but George holds her back.

George: Number one, or two?

Estel: GEORGE.

Frank: For GOD’S SAKE MAN!  Move out of your mother’s way!  THINK of the SPECIAL!

Estel pushes by George in a hurry and slams the door.

George: ONE OR TWO!?  ONE OR TWO!?

Estel starts moaning.  George crumples to the floor.

George: And there it goes!  There it goes.  It's ruined.  

Estel, inside the bathroom: Frank, we're going to be here awhile.

George: NOOO!!!

Frank: I'll meet you there.  I'm NOT MISSING the SPECIAL!!!!

 ",seinfeld,1555118262,LupinClickTerror,4,10,True,2019-04-12
203,Happy papi?,"This line has stayed with me since I first saw the episode 10+ years ago. 

What's everyone's most quoted line?",seinfeld,1555148783,bigfranky145,7,10,True,2019-04-13
221,"When Jerry tells the joke about being shot out of a cannon instead of taking a flight, he tells the joke from the orientation of California, instead of New York.","I know the show was filmed in Los Angeles, but it takes place in New York, and presumably, the stand-up scenes also take place in New York.

In Season 2, Episode 12, he tells a joke about missing a plane, and being shot out of a cannon. As the cannon operator, Jerry first rotates to his left saying ""Chicago"". This first rotation is not important. But then he says ""Oh, Dallas"", and he rotates to his right. Dallas is south of Chicago, so if Jerry was in New York, which is east of both aforementioned cities, he should have rotated to his left again, which would simulate a pivot from north to south from the position of New York. But the way he actually does it indicates he is west of both cities, which means he was thinking about his position in Los Angeles.

I don't want this to come off as a complaint. It's just a fun observation.",seinfeld,1555204475,red_4,13,49,True,2019-04-13
225,"If Seinfeld returned for an episode/season/film, how would you want it done?","There's no option for 'not at all' or 'leave it alone'. Choose what you would want to see, if this happened all these years later. Where would Jerry, George, Kramer, Elaine, Newman, etc. all be? Which side characters would make appearances? Jackie Chiles? The Soup Nazi? Uncle Leo? You choose what happens.",seinfeld,1555223585,Stone36,2,1,True,2019-04-14
232,Indoor Drumline Show Using Seinfeld Quotes,"Franklin Central High School 2019

A Show About Nothing

[Video](https://youtu.be/bb7p-PaOb-8)",seinfeld,1555262225,freshfinn,0,2,True,2019-04-14
240,curb your enthusiasm Seinfeld ep,"Is that “episode” in the Seinfeld canon??   I think so, great quotes

George’s itoilet is classic",seinfeld,1555285030,Chgarcia345,2,6,True,2019-04-14
242,I've always loved the irony of George passionately declaring that he wants to die without dignity.,,seinfeld,1555286464,red_4,2,18,True,2019-04-14
245,"Think again, long shanks",,seinfeld,1555289577,bobbyklang,0,2,True,2019-04-14
246,I don't like her,What do you mean you don't like her,seinfeld,1555291341,schwartzasher,5,2,True,2019-04-14
254,Would you date any of them?,"One of the main themes of shows seems to be that all of the characters are very self involved. I for one never felt this way but it was pointed out on a podcast and when I think about it there is an argument for it. I think the worst offender in many ways is Jerry but I don't consider him to be bad guy. 

So of the main cast; Jerry, Kramer, Elaine and George which would you date? 

I think Kramer would be the worst because whilst I do think he is well meaning his flightiness and his lack of awareness would annoy me.  I doubt you could really rely on him to do anything for you and he would not be entirely trust worthy, not in a horrible way, more that he just wouldn't realise how he was behaving.",seinfeld,1555309214,endangeredpenguin,9,3,True,2019-04-15
258,"In “the glasses”, Jerry uses the line “wanna get some pizza” to try get out of trouble. Can you create some other scenarios he might use that line for?",,seinfeld,1555324806,jh99999,6,8,True,2019-04-15
266,"[Podcast] No Hugging, No Learning - The Trip, Part 1 (S4E01)","Season 4 is under way as we talk about part 1 of The Trip, film deterioration between seasons, George being trendy by present-day standards and the latest with our r/Seinfeld downvoter! 

This is No Hugging, No Learning, the show about one thing...watching Seinfeld for the first time.

New episodes every Sunday!

[New Episode](http://nohuggingnolearning.libsyn.com/the-trip-part-1-s4e01) // [iTunes](https://itunes.apple.com/us/podcast/no-hugging-no-learning/id1434886441) // [Spotify](https://open.spotify.com/show/5Q183GYUYXLPyj2RHw3NpX) // [Stitcher](https://www.stitcher.com/podcast/tim-murphy-and-ted-hallowell/no-hugging-no-learning) // [RSS Feed](http://nohuggingnolearning.libsyn.com/rss) // [Website](http://nohugging.com/) // [Twitter](http://twitter.com/@nohugging)

This is a show for people that have never seen Seinfeld, like me, or who are just looking for a fresh perspective on it. I'm watching Seinfeld for the first time and my co-host is watching back for the first time chronologically, after being a huge fan for years.

Have you been a lifelong fan of Seinfeld? We'd love to hear your take on these episodes too, because we don't go very heavy on research. Feel free to comment, [send us an email](mailto:nohuggingnolearningshow@gmail.com) or [DM us](https://twitter.com/nohugging)!

https://i.redd.it/1w09vgse7gs21.jpg",seinfeld,1555342892,TheTedHallowell,1,3,True,2019-04-15
278,Jerry tells Bookman The Library Cop He Doesn't drink coffee?,"Just watching the youtube clip of Bookman The Library Cop coming to Jerry's apartment.

&amp;#x200B;

Jerry offers him a cup of tea, but Bookman asks for coffee, and Jerry replies, ""Coffee?..No, I don't drink coffee.""

&amp;#x200B;

I've seen this clip a 100 times and never caught that before. Anyone else ever noticed it?",seinfeld,1555384448,AlphaBravoPL,7,4,True,2019-04-15
292,"When Jason Alexander complained to Larry David about a line of George, arguing that no one would react like that, and Larry replied ""I did"", what line or scene where they talking about?",,seinfeld,1555434091,depressed_betamanlet,10,6,True,2019-04-16
307,Where are they now?,"There seems to be an idea in the minds of certain members of the cast that something called ""The Seinfeld Curse"" is a real thing, I can only assumed that the cast could never get bigger or that they are typecast and so will never be taken seriously. So where are they now and where would you like them to be?

Jerry is still doing the occasional stand up and from what I have heard (I don't follow Pop Culture so I don't know if this is for real) he is a grumpy old man who seems to resent people getting into comedy and if you look him up on IMDB he actually seems to have done very little but this could just be that he doesn't see himself as an actor. That he is a comedian first and an actor second.

Michael is likely to be remembered for the racist outburst than anything else these days and honestly I am not sure it should be forgotten. He seems to have done a bit more than Jerry but not much more. I enjoyed him in Seinfeld but I don't know if he has much range. With that being said I haven't seen anything else with him so it is hard to judge,

Julia seems to have done mostly TV work with the occasional film but the only film I know her from is Enough Said staring alongside James Gandolfini in what I feel is a very underrated film about relationships in middle age. She was very strong in this but I still couldn't shake her from being Elaine.

Jason seems to have had by far the best career, whilst I have not seen him in anything other than Seinfeld he does seem to have had a lot of TV time and even some films - though from what I have heard he was a big deal on the stage before joining the cast.

So I guess I need to go back the original question; where are they now and where would you like them to be? Do you think the ""Seinfeld Curse"" is a real thing? It is possible that they carved the niche in Seinfeld and would never be thought of in any other way or is that they are simply not great actors? I would like to think of all four actors having good careers and I wish them well. I just worry this is not the case. But what are your thoughts?",seinfeld,1555479609,endangeredpenguin,10,0,True,2019-04-17
313,Has anyone seen this shirt before?,"I saw it and was like HOLY SHIT I LOVE THAT. But who is the artist? I cant seem to find it anywhere or if it's even available still?

[https://imgur.com/KB2JNk4](https://imgur.com/KB2JNk4)",seinfeld,1555499610,plasticinehouse,2,2,True,2019-04-17
314,Plaza Cable chase in Times Square,"Did they really go there to just film normally in the street for that one scene? It's funny to watch the reactions of people as they run across.

Also, when Kramer turns his head sideways when crossing it kind of looks like a double.",seinfeld,1555501039,firioz,4,3,True,2019-04-17
320,"Yes Kramer, I've been reviewing your work. Quite frankly it stinks."," 

No, no, I don't think that's going to, do it, uh. These reports you handed in. It's almost as if you have no business training at all..

I don't know what this is supposed to be!... 

Well, I'm sorry. There's just no way that we could keep you on.",seinfeld,1555515825,alexh2795,6,13,True,2019-04-17
322,George Costanza ringtone,"I downloaded the George costanza voice mail to the files app on my iPhone X. I was just wondering if there’s any way I can get it as my ringtone (seeing as it was from a ring tone app). 

The file downloaded as .m4p which I believe is the correct format however it doesn’t show up in settings as a ringtone.
Help me pleaseeeeee",seinfeld,1555516683,2001kody,3,0,True,2019-04-17
331,Seinfeld Podcast - New Episode Out,"Our Seinfeld podcast But I Don’t Want to be a Secondary Character! has just released our latest episode about The Pick.

We chat about the secondary characters from the episode. You can listen on any podcast app or platform by typing “Seinfeld” and finding us.

Giddy up!",seinfeld,1555537397,BIDWBASC,0,2,True,2019-04-17
333,New Seinfeld Facebook Group,"Helllloooo!
I’ve created a new Facebook Group [Seinfeldisms](https://www.facebook.com/groups/874797302863221/?ref=share) that you can join and have fun on!",seinfeld,1555538209,TNSEB,0,0,True,2019-04-17
337,NBC News: Babies with 'bubble boy disease' cured using gene therapy, [https://www.nbcnews.com/health/kids-health/bubble-boy-disease-cured-using-hiv-gene-therapy-st-jude-n995631](https://www.nbcnews.com/health/kids-health/bubble-boy-disease-cured-using-hiv-gene-therapy-st-jude-n995631),seinfeld,1555541339,broken_pencil_lead,0,0,True,2019-04-17
341,"What’s the best comeback to, “What’s the difference, you’re their all-time best seller”?",,seinfeld,1555542876,andytheg,4,3,True,2019-04-17
377,Susan Ross was the best girlfriend.,"She was pretty, smart, funny, kinky, bent over backwards for George, and also tough enough to call him out on his bullshit. She was a solid 10.

Although I will concede she was dumb for not using a damp sponge on those envelopes.",seinfeld,1555648419,red_4,20,6,True,2019-04-19
390,So did Ray really steal the statue?,,seinfeld,1555684580,LanceMurdoch,9,5,True,2019-04-19
397,Any suggestions which episode I should use for a discourse analysis?,"I have to analyze an episode from a show - I chose Seinfeld - and I have to analyze it to make an interpretive claim about its cultural meaning. So I have to extract a meaning/message that the creators want to display and send to the consumers (based on theories by Stuart Hall) and I have to base this on contextual signs (decor, text, camerawork, etc.). Any suggestions for a usable episode? I know the contest is easy since since it is obviously revolutionary tv, but I kinda want something a little deeper.",seinfeld,1555691734,AnxietyStore,3,1,True,2019-04-19
416,"If Seinfeld crossed over with The Office for one episode, what would you want to see?","Think of the shows as if they were both in their prime, or maybe you could make up a reunion episode for both, up to you",seinfeld,1555747075,Stone36,7,0,True,2019-04-20
443,Buying a used car.,"&amp;#x200B;

https://i.redd.it/srzz9znosit21.jpg",seinfeld,1555810135,gaz0rpazorp,0,1,True,2019-04-20
444,Serenity Now...... Insanity Later.....,"&amp;#x200B;

https://i.redd.it/dltomh8atit21.jpg",seinfeld,1555810377,gaz0rpazorp,2,4,True,2019-04-20
445,“The question is . .,". . . wouldn’t u rather date the blind or the dead?”


Easy choice me me: the dead, for sure",seinfeld,1555813978,Tim-Whatley-DDS,3,1,True,2019-04-20
454,Worst Seinfeld episode is hands-down...,"...""The Checks"". I've seen various ranked lists, and that episode should be dead last on principle. The jokes fall flat and each charcter's storyline is zany. I mean...George trying to get into a cult of carpet cleaners, Jerry trying to prove he invented umbrella twirling, Kramer and the Japanese tourists, and worst of all...Elaine's boyfriend being obsessed with Farbman furniture. The only funny moment in the whole episode is Kramer saying goodnight to the Japanese guys in the chest drawers.",seinfeld,1555834206,DrInquistive,28,0,True,2019-04-21
