,title,selftext,subreddit,created_utc,author,num_comments,score,is_self,timestamp
216,What's your favorite episode? Mine's flavn.,,seinfeld,1547641531,red_4,31,1,True,2019-01-16
234,Corner gas is just low-budget Canadian seinfeld.,That's a fact.,seinfeld,1547676527,vsd_123,8,1,True,2019-01-16
237,Can someone please link me that picture of George holding a mug?,I've tried google but I only get pictures of that on a mug. I want just the original screenshot.,seinfeld,1547688516,h77IM,9,1,True,2019-01-16
240,TBS speeding up Seinfeld???,Just watching a DVR recording of The Caddy from TBS.  Am I crazy or have they sped up dialogue and pacing... seems to be like x1.5 faster than original??? Cramming additional ads in for more $$$ 😕,seinfeld,1547692563,metaleric84,7,1,True,2019-01-16
247,"What do you think of an alarm clock, that automatically tells you the weather when you wake up?",,seinfeld,1547728527,eightythreelebaron,1,1,True,2019-01-17
248,George is in for quite the surprise,"&amp;#x200B;

https://i.redd.it/60q0d7hxhza21.jpg",seinfeld,1547731219,dtm106,0,1,True,2019-01-17
250,Nickname for hockey jersey,"My friends are getting custom hockey jerseys with nicknames on the back. I don't have a nickname, what should I put on the back of my jersey, David Puddy? My name is Kevin, Bizarro Jerry? What ya got?",seinfeld,1547734330,commanderkev,9,1,True,2019-01-17
255,Are you master of your domain?,,seinfeld,1547746218,marques33,10,1,True,2019-01-17
258,So was George planning on releasing right there on there floor?,,seinfeld,1547761040,the_turtle82,9,1,True,2019-01-17
260,Ranking Jerry's Girlfriends,Who are your top ten?,seinfeld,1547775806,angrynerdist84,38,1,True,2019-01-17
266,"I find it interesting that Kramer mocked Lloyd Braun’s name tag idea in the frozen yogurt, but in the kiss hello he put up that huge board with everyone’s name and picture",,seinfeld,1547815689,mr-mashed-bgravy,18,1,True,2019-01-18
273,Basic Instinct has a lot of Seinfeld people in it,"I think there are six people in Basic Instinct that are also on Seinfeld.  It’s so surreal to watch because of the connections.

Wayne Knight plays Newman on Seinfeld and then plays John Correli, the district attorney in Basic Instinct. 

Daniel von Bargen (RIP) plays Kruger of Kruger Industries in Seinfeld and plays Lieutenant Nilsen in Basic Instinct. 

Stephen Tobolowsky plays Tor on the episode “The Heart Attack” in Seinfeld and Dr. Lamott In Basic Instinct. 

Jack McGee plays Ralph on the episode “The Pothole” and plays the sheriff in Basic Instinct.

Bradford English plays the Cop in the episode “The Robbery” and plays the campus police officer in Basic Instinct. 

James Rebhorn (R.I.P.) played the D.A. On the episode “The Finale” and plays Dr. McElweine in Basic Instinct.  

I think that is it.


",seinfeld,1547830228,donnabert,6,1,True,2019-01-18
277,Seinfeld PI,[https://www.youtube.com/watch?v=mN-DF4jkw64](https://www.youtube.com/watch?v=mN-DF4jkw64),seinfeld,1547834858,Smartcarquestionmark,3,1,True,2019-01-18
282,What episode does jerry say Yama Hama? It’s not the strike.,"Just about everyone else does in the strike, but I know he says it in another episode. Which one? Thanks.
",seinfeld,1547848438,johnnyshredz,10,1,True,2019-01-18
291,The Penske File Tutorial - How to work the penske file,"i love the Pensive File. So much that i made a funny 2 min video for youtube - ""the Penske File Tutorial"" this has got to be one of the funniest episodes of Seinfeld. Everyone should know how to work on the Penske File.

If you want to have a laugh for two minutes, do a search in youtube for ""the penske file tutorial""  hope you enjoy.

&amp;#x200B;

thanks

&amp;#x200B;

Boredtopia",seinfeld,1547877428,boredtopia,1,1,True,2019-01-19
301,Probably not the first to notice.,Isn’t the music video “dancing in the street” the puffy shirt? Mick Jagger and David Bowie knew what they were doing.,seinfeld,1547929624,Unclestanky,0,1,True,2019-01-19
305,I realized why they took George’s belt when he was committed into the mental asylum,All these years I thought it was just a random line. But then I realized. They didn’t want him to hang himself,seinfeld,1547939964,WellOfSouls3333,7,1,True,2019-01-19
309,It cost $12 and its too small but more than worth it,Sorry about the horizontal,seinfeld,1547959417,shtrooooooooooooodle,5,1,True,2019-01-19
316,What are some of your favourite first world problem discussions done on the show?,"For instance, in one episode, George discusses with his fiancée about the length of the toilet door. ",seinfeld,1548004560,IamVivekVV,11,1,True,2019-01-20
321,A show about fabrics,"it occured to me that specific fabric/clothing materials have been mentioned on the show more than one would expect. These are what I could remember in no particular order. I have probably missed some.

* velvet, everything with the velvet
* you like saying GORE-TEX
* the only thing between kramer and us is a thin layer of gabardine
* jake jarmel felt elaine's material, which was also gabardine
* jerry's suede jacket
* bras are made of Lycra Spandex
* kramer's cookin up some corduroy
* the mohair sweater
* the cashmere sweater
* polyester yankee uniforms (they made leisure suits out of it!)
* cotton yankee uniforms (well it IS a natural fiber)
* elaine's touchable shirt has an almost terrycloth-like feel 

* jerry has a shirt which is 50% 50% 50% but i cant remember the materials. cotton, linen and silk?


",seinfeld,1548015632,kvuo75,26,1,True,2019-01-20
326,Darren Kramer’s intern from NYU is one of my favorite one episode characters. I love how he took kramerica so seriously.,,seinfeld,1548029209,mr-mashed-bgravy,19,1,True,2019-01-20
328,"Yeah, I think you would","&amp;#x200B;

https://i.redd.it/em3mnii6dob21.png",seinfeld,1548032274,dtm106,0,1,True,2019-01-20
329,"Yeah, I think you would","&amp;#x200B;

*Processing img vvpqlma5eob21...*",seinfeld,1548032593,dtm106,0,1,True,2019-01-20
341,anyone else actually get pissed off when elaine throws george’s toupee away?,"there was no reason to, he was happy everyone was happy. what the hell!",seinfeld,1548079948,gmez3,11,1,True,2019-01-21
363,Dustin Hoffman was in Star Wars,What kind of a name is Todd Gack anyway?,seinfeld,1548117282,Kuzuri0183,6,1,True,2019-01-21
364,Where to watch Seinfeld,We all have Netflix for the office. Hulu for KOTH. Where do I go for Seinfeld. This question may have been answered . But I am wondering if anyone has a go to streaming service,seinfeld,1548118383,CadaverAbuse,11,1,True,2019-01-21
382,Seinfeld breaking the 4th wall,"Im looking for the episode or the clip where Seinfeld and Goerge are sitting at the restaurant and talk about making a TV show (Seinfeld) where they would be actor.   


Thanks!",seinfeld,1548170966,Alastor3,10,1,True,2019-01-22
392,The Foundation (S8E1) is about Larry David?,"My friend brought this up to me and it's not mentioned on the [Wikipedia](https://en.wikipedia.org/wiki/The_Foundation_(Seinfeld)) page:  


The Foundation is the first episode without Larry David.  And they have the story line where Peterman leaves the catalog and leaves Elaine to run it.      THIS IS ABOUT LARRY DAVID, RIGHT?",seinfeld,1548183477,fakdaddy,3,1,True,2019-01-22
393,Elaine Benes ethical question,"In the soup nazi episode, Elaine is insinuated to have published the soup nazi's recipes all over town.  Was this too far?  Sure he was rude to her, but she ruined his business.  Who do you side with here?",seinfeld,1548183743,Bomberman64wasdecent,6,1,True,2019-01-22
400,What would Seinfeld have looked like if George and Susan actually got married?,"Been watching season 7 (again) and got to wonder what would Seinfeld have looked like if George and Susan actually got married? Here's what I came up with:  

* Jerry still breaks up with Jeannie and is seated at the singles table w/ all the kids poking fun at him for being single.  
* In a final desperate attempt to get a date for the wedding, Elaine gets Newman to be her +1.  
* On his way back home from the wedding, Kramer gets lost and runs into a roadblock w/ a signs that read ""No Return"" and ""Turn Left"". Kramer is never seen again for the remainder of the season.  
* A couple months after the wedding, George is unhappily married to Susan, and tells Jerry that she wants to have kids. ""Kids, Jerry! That's the point of no return!"" — cue in bit about Jerry asking George if the point of no return is a straight road, or a left turn.",seinfeld,1548223266,SmokingFrog,17,1,True,2019-01-23
402,Why does Kramer move so erratically?,Was there every an explanation for it? ,seinfeld,1548231409,Agent666-Omega,13,1,True,2019-01-23
403,Is Cousin Jeffrey ever visibly seen throughout the show?,"Other than the blurry horse scene that is.

I just realized that I always mixed him up with Fred Yerkes (the guy Elaine dates only cos he forgot her).",seinfeld,1548235980,gaop,11,1,True,2019-01-23
404,"Recently got into Seinfeld , the jump in quality between season 1/2 and 3 is insane","Season 1 and 2 weren't bad by any means but they weren't great either , I'd say average , but now I'm 6 episodes into season 3 and every single episode is miles better than anything from s1-2",seinfeld,1548242458,ShadowCrimson,209,1,True,2019-01-23
407,Can someone name the jazz song from 1st 15sec of Comedian in Cars Getting Coffee w/Julia Louis Dreyfus?,"real jazzy song

season 2 episode 6",seinfeld,1548257581,swingthatwang,11,1,True,2019-01-23
410,Seinfeld finale,I just recently saw the finale of Seinfeld and I must say I thought it was garbage. I was annoyed with how the show ended but that’s just my opinion.,seinfeld,1548264785,da-blubbery-walrus,16,1,True,2019-01-23
411,I spent a month there one night,I noticed Kramer says this in The Merv Griffin Show episode. Is there any specific meaning to this sentence or is it just INCOHERENT DRIVEL?,seinfeld,1548267275,Batman_Seinfeld,4,1,True,2019-01-23
418,Was there an episode where Kramer had some scheme dealing with the little salt packets (not actually salt) that are found in the pockets of new clothes?,"I'm trying to think of an episode where I swear Kramer wanted to collect a bunch of those little packets that are found in the pockets of nice clothes at department stores.

Either I'm crazy or someone here knows what I'm talking about.  Please help?",seinfeld,1548280662,The_Laviathen_Builds,11,1,True,2019-01-23
424,I never understood the opinion that Seinfeld was a show about nothing.,"It always seemed like a show that understood how big insecurities play a role in our lives.

Almost like a show based on these four characters egos and we loved it because we all related to that.  It knew ego wasn't ""nothing"" but rather ""everything"".

Am I alone in thinking like this or have I nailed it?",seinfeld,1548294555,The_Laviathen_Builds,13,1,True,2019-01-23
427,Fine Art,What is the official name of this piece? ,seinfeld,1548302007,Betajackson,0,1,True,2019-01-23
429,Interesting fact I discovered about Larry David cameo,"So today I was playing computer games with Seinfeld playing in the background just so I could listen to it, when I got to s04e14 The Movie and it dawned on me all the movies playing in the theaters are voiced by Larry David",seinfeld,1548308180,DonnyBrownTheClown,9,1,True,2019-01-24
430,Just started watching the Sopranos and keep imagining Junior Soprano as Larry David. What a show that would be...,I can only imagine the plot lines for it.,seinfeld,1548314677,ryker272,2,1,True,2019-01-24
436,"[Podcast] No Hugging, No Learning - The Red Dot (S3E12)","This week, Tim and Ted recap the first (kind of) Christmas episode in the run of the show, The Red Dot! They also talk about the return of AWFUL b-roll, an overused awful stand-up bit and how this episode felt like a giant ad.

This is No Hugging, No Learning, the show about one thing...watching Seinfeld for the first time.

New episodes every Sunday!

[New Episode](http://nohuggingnolearning.libsyn.com/the-red-dot-s3e12) // [iTunes](https://itunes.apple.com/us/podcast/no-hugging-no-learning/id1434886441) // [Spotify](https://open.spotify.com/show/5Q183GYUYXLPyj2RHw3NpX) // [Stitcher](https://www.stitcher.com/podcast/tim-murphy-and-ted-hallowell/no-hugging-no-learning) // [RSS Feed](http://nohuggingnolearning.libsyn.com/rss)

https://i.redd.it/p1ekrvsd9ec21.jpg",seinfeld,1548345793,TheTedHallowell,0,1,True,2019-01-24
439,Can someone explain to me why they watch the show?,"I'm not trying to start an argument with anyone. I just genuinely find myself faced with this television show that everyone loves, but I for some strange reason don't really get a kick out of. Maybe it's the laugh track or the general howdy-doody, no real impact plot, but I don't get why people say they laugh when watching the show.

&amp;#x200B;

This is not a diss on Seinfeld or David, in fact I love Curb Your Enthusiasm,  but it's a very different tone. I'm not sure how accurate it would be, but there's something fitting about being referred to as the r rated Seinfeld. Again, two different ballparks, and Jerry obviously knew what he was doing, he had stopping power, he has his fame, everything he earned, but there's just something that doesn't really hit home, personally.",seinfeld,1548359127,Godredd,19,1,True,2019-01-24
441,Witchy Woman,What episode does Elaine say that Witchy Woman by the Eagles is her favorite song? Or whoever mentions it,seinfeld,1548368984,amelialav01,4,1,True,2019-01-24
449,I caught my wife cheating on me today.,"I came home from work a couple of hours earlier than usual today. I found my wife in the living room watching Friends on the TV. She knows how much I love the superior ‘90s sit-com, Seinfeld. What should I do?


/s",seinfeld,1548384153,eccary,16,1,True,2019-01-24
454,Anyone else willing to admit that a large portion of their humor comes from the study of Seinfeld? lol,"I'm generally considered to be a funny guy. And I will take credit for being fairly witty. HOWEVER, if I am to be completely honest, I steal a metric ton from Seinfeld. And I don't mean just cribbing lines. I mean, the timing, the mannerisms, and the general framework that one can glean from watching 10,000 hours of Seinfeld. 

I'm a little ambivalent about it, but I've been happy to see that I've more or less internalized it over the years, that's it's no longer ripping off Jerry's material; I can actually say in good conscience that I'm influenced by Seinfeld. And most people probably have no idea. But a Seinfeld fan would pick it up instantly. And I'm okay with that, too. 

",seinfeld,1548391951,RapeWhistleJazz,7,1,True,2019-01-24
465,New Jersey Devils David Puddy bobblehead,"The Devils had a 90s night and are giving away Puddy bobbleheads!! It is on February 19th. The site only mentioned ""90s theme bobblehead"" but a radio ad I heard said ""come support the team"", a take on ""gotta support the team"" , and mentioned a David Puddy bobblehead for first 9000 fans! Buy your tickets now!

THE DEVILSSS!",seinfeld,1548424473,raysoto19,4,1,True,2019-01-25
466,episode? George convinced universe will strike him down for being happy,"DAE remember an episode where george has too good of luck, and becomes convinced the universe isn't going to allow it and will strike him down?
(or something similar).
i seem to remember this, yet cannot figure out what episode it is.
",seinfeld,1548428117,chocotaco1981,3,1,True,2019-01-25
484,"S1 E2, The Postponement, breaks the 'no learning' rule.","At the beginning Elaine explains she has made a conciliatory deal with the dog owner re the barking. Also, Kramer rants about getting a criminal record over the dognapping.",seinfeld,1548456100,quite-the-contrarian,0,1,True,2019-01-25
485,"I know they filmed most of this in front of a studio audience, but did they ever film anything at like 2 or 3AM or something?",For some reason this popped into my head recently. Interested in this bit of the production lore if anyone knows. I guess it’d have to be something like Kramer going into the water in a burlap sack. Or something. Anyone know! Did they ever push the production schedule to very late/early hours?,seinfeld,1548460149,asking_about_re2,5,1,True,2019-01-25
497,Notable episodes with extended Kramer falling?,,seinfeld,1548522836,OriginalNord,16,1,True,2019-01-26
0,I just noticed something about The Elaine Mannequin from THE PIE Episode... Definetely wouldn't be made today.,"When Elaine goes back to the store with George the Clerk posed the Mannequin in a  very ""risque "" position. She was bent over the guys lap about to be spanked lol. No way you get away with that today. People would flip out. ",seinfeld,1544202686,filthylilbeast,1,1,True,2018-12-07
2,Do any fans out there have a Seinfeld tattoo? I want to get Elaine on my calf but don't know what style to go with.,,seinfeld,1544215070,peachrabbit85,5,1,True,2018-12-07
15,Does anyone else exchange random Seinfeld reference gifts with fellow fans/friends?,"My friend, who knows about as much useless Seinfeld minutiae as I do and I exchange random Seinfeld related gifts to each other whenever we get to see each other. We live in different states so anytime we get to exchange is great. I’ve given him these items and I’m curious if everyone could understand the references!

Arturo Toscani vinyl record, Kenny Rogers vinyl record, pack of wrigley’s doublemint gum, Schindler’s List on double VHS, and a check for $19.45.

I’d be interested in what you guys have exchanged with your friends who love the show!",seinfeld,1544319995,danmader,5,1,True,2018-12-08
31,"""Can we at least put some lights on it?"" ""NO! I find tinsel distracting--I can't even imagine lights!""",[I got a lot of problems with you people!](https://i.imgur.com/Kfbw1Cu.jpg),seinfeld,1544385209,GrokTheShape,0,1,True,2018-12-09
37,Am I the only one who can’t hear the word “Tuberculosis” without thinking of Seinfeld?,,seinfeld,1544409297,utechap,1,1,True,2018-12-09
38,The Stall is such a great episode.,That is all. ,seinfeld,1544414259,kerouacrimbaud,4,1,True,2018-12-09
41,'I would have marched on Selma if it was in Long Island.' - Please explain this supposedly genius Seinfeld line,Why is this so funny?,seinfeld,1544451227,BarryHero,8,1,True,2018-12-10
42,"[Podcast] No Hugging, No Learning - The Cafe (S3E07)","`&lt;iframe style=""border: none"" src=""`[`//html5-player.libsyn.com/embed/episode/id/7856915/height/90/theme/custom/thumbnail/yes/preload/no/direction/forward/render-playlist/no/custom-color/377cc9/`](//html5-player.libsyn.com/embed/episode/id/7856915/height/90/theme/custom/thumbnail/yes/preload/no/direction/forward/render-playlist/no/custom-color/377cc9/)`"" height=""90"" width=""100%"" scrolling=""no""  allowfullscreen webkitallowfullscreen mozallowfullscreen oallowfullscreen msallowfullscreen&gt;&lt;/iframe&gt;`

This week, we recap The Cafe and talk about SAT scores, pocket food and how much Jerry loves to stroke his own ego. 

This is No Hugging, No Learning, the show about one thing...watching Seinfeld for the first time.

New episodes every Sunday!

[New Episode](http://nohuggingnolearning.libsyn.com/the-cafe-s3e07) // [iTunes](https://itunes.apple.com/us/podcast/no-hugging-no-learning/id1434886441) // [Spotify](https://open.spotify.com/show/5Q183GYUYXLPyj2RHw3NpX) // [Stitcher](https://www.stitcher.com/podcast/tim-murphy-and-ted-hallowell/no-hugging-no-learning) // [RSS Feed](http://nohuggingnolearning.libsyn.com/rss)

https://i.redd.it/yddtduak1h321.jpg",seinfeld,1544456906,TheTedHallowell,0,1,True,2018-12-10
49,You know I've kiboshed before,And I will kibosh again,seinfeld,1544469466,supersonicity,1,1,True,2018-12-10
55,"Question: $20,000 Bonus to Larry David from Castle Rock","I've been watching a documentary ""How it all began"" on YouTube ([https://www.youtube.com/watch?v=I8\_2hPjljag&amp;list=WL&amp;index=142&amp;t=862s](https://www.youtube.com/watch?v=I8_2hPjljag&amp;list=WL&amp;index=142&amp;t=862s)) and around the 44 minute mark there is a quick line spoken by Larry David about solving a problem with the script/episode for Castle Rock and getting at $20,000 and a commitment to become the shows EVP. 

Does anyone have insight as to what Larry David solved? I'm curious about what he did to earn that bonus and the position. There are a number of references confirming the event, but none get into any details.

""Something needed to be fixed.""

&amp;#x200B;

Thanks \~",seinfeld,1544482802,whitefrogmatt,1,1,True,2018-12-10
68,What’s your favorite episode??,"I’m sure this has been done in the past but I’d like to get this going as my first post. 

Mine is easily the butter shave (S9E1). It’s by far the funniest episode. A lot of stuff you don’t have to think about.  It starts out with the mustaches. George fakes a disability and Newman tries to eat Kramer. Oh yeah and let’s not forget about vegetable lasagna. ",seinfeld,1544534351,crowleycat20,7,1,True,2018-12-11
71,What are your top 3 favorite Seinfeld scenes?,"If you had to whittle it down to only three, what would you say are your favorite scenes? I wanted to pick only one but I can't, these scenes are hands-down my very favorite and it was too hard to pick only one.

Mine are:

[""I saw Jane topless""](https://youtu.be/GpUQyXI0Sns?t=125)

[Mary Contardi](https://www.youtube.com/watch?v=kvCb-Kp2DpQ)

[""What happened to the test!?""](https://www.youtube.com/watch?v=12KOazXUobw)

Try to link them for easy viewing.",seinfeld,1544539333,billyfreddy,16,1,True,2018-12-11
80,We had a packed you know,What...I didn't mean it. I only shook your hand. ,seinfeld,1544573644,schwartzasher,6,1,True,2018-12-11
85,I want Key / Peele to take on a 5-episode remake of Seinfeld,"Keegan-Michael Key as Jerry Seinfeld

Kristen Bell as Elaine Benes

Jason Mantzoukas as Cosmo Kramer

Jordan Peele as George Costanza

featuring Nick Kroll as Newman

WHO WOULDNT WATCH THIS",seinfeld,1544585176,likexmas,2,1,True,2018-12-11
89,"Just thought you guys should know that if you search Festivus on google, it puts the Festivus pole on the side of the webpage.",,seinfeld,1544596355,-Mamba-,4,1,True,2018-12-12
91,What is your Seinfeld 'unpopular opinion'?,,seinfeld,1544614742,npjobs,28,1,True,2018-12-12
94,What are some Seinfeld themed gifts?,Just looking for some ideas for a gift for a Seinfeld lover. Hope to find some suggestions here!,seinfeld,1544622325,choooooooooose,19,1,True,2018-12-12
99,As awful as the characters behave...,"It feels like they act on what secretly goes through our heads most of the time, lol. ",seinfeld,1544637058,todashmacroverse,2,1,True,2018-12-12
100,Festivus Party Ideas,"Celebrating Festivus with a bunch of friends this Friday, anyone have ideas for party games to categorize feats of strength? I have several Festivus prizes for the winners, looking for games or F.O.S. that 20ish people can participate in.

&amp;#x200B;

Thanks!

(So far I have a holiday stein hold, and ""best Airing of Grievances"" on the docket)",seinfeld,1544642695,bucsdude5588,0,1,True,2018-12-12
103,Yes you’re once! Twice! Three times a la..Ahhhh! Ahhhhh! Oh the humanity!-Newman,,seinfeld,1544650227,volvo928,9,1,True,2018-12-12
105,We can get 80 hooks on here!,You're quite mad you know.....,seinfeld,1544651707,LookBackInAnger1982,1,1,True,2018-12-12
107,Need Help Figuring out Episode,"I honestly can't figure out what episode this is. Jerry and a girl are on a double date with George and a girl. George asks Jerry to act dumb or something to seem more impressive. When the scene is cutting out, George waves over the waitress and says something like ""Sweetie the tea... it's cold.""",seinfeld,1544657444,slabstick22,7,1,True,2018-12-12
109,Remember the Seinfeld online video game?,"It was around the last season of the show and it involved throwing the rye bread up to George. I can’t find anything about it online, it was actually pretty fun. ",seinfeld,1544670177,audierules,0,1,True,2018-12-12
114,Is Kramer a murderer?,"In the trip at the start of season 4, Kramer gets wrapped up in this police investigation 

Based on further investigation, he is a suspect because of his head shot with the victim, someone kramer had just left an audtion with. Is it clarified how the girl actually died though? ",seinfeld,1544679955,ravensfoster,5,1,True,2018-12-13
123,Have you been wearing a fake beard?,,seinfeld,1544726706,CrestedBlazer,3,1,True,2018-12-13
128,is Seinfeld still good in 2018?,"I'm a 22 year old college student who's never seen Seinfeld. I recently saw a scene somwhere and it peaked my interest. Would it be an enjoyable series to watch right now if you've never seen it before and thus, there's no nostalgia factor that would play into the level of entertainment that the show provides? Would love to hear your thoughts",seinfeld,1544733057,itscamillataylor,118,1,True,2018-12-13
132,Monologue question,Which episode is it where Jerry talks about being at the doctors and in the room there’s the poster of the man cut in half with the arms down ,seinfeld,1544755893,Nurnzzzz,2,1,True,2018-12-13
136,I'm worried about kastanza,I saw his car. There's scratches on it and the front is dented in. There's blood inside I'm worried about him,seinfeld,1544762697,schwartzasher,3,1,True,2018-12-13
144,Why is Seinfeld so Important?,"Let me start this post by saying that i don't hate Seinfeld or believe it's a terrible show. I want to start this post by asking what made Seinfeld an important TV show and why it still holds til this day. 

I'm 19 years old so i wasn't able to see Seinfeld when it first aired but i have seen re-runs and the show is funny like everyone says it is. 

So, what made Seinfeld a big deal? And why is still a relevant show? Was Jerry the biggest comic alive or did the show air ""in the right time and the right place?"" Can anyone fill me in?",seinfeld,1544813058,Chronic_The_Kid,11,1,True,2018-12-14
